,name,apeal,copy,employment_status,incoms
224,株式会社タイセイリサイクル,リサイクル事業を展開＊環境省「エコアクション21」の認証取得,高収入×力仕事なし☆未経験でも始めやすい【工場作業スタッフ】,正社員,400万円～500万円
225,株式会社grits,月給25万円以上／2021年5月新オフィス移転予定／年休125日以上,【営業】医療業界・士業に特化したWEBマーケティングを提案！,正社員,300万円～1000万円
226,株式会社アイアンドディハヤト,★月給25万円以上+インセンティブ★昇給・賞与有★年休120日以上,顧客の採用支援に幅広く携われる【人材コンサルティング営業】,正社員,300万円～400万円
227,株式会社ホームタウンよこはま,【横浜エリア＆業界内で高い知名度】★新店オープンメンバー募集,未経験から【不動産営業】平均年収1412万円しかも定着率95％超,正社員,400万円～2500万円
228,ブリリアント・フューチャー・パートナーズ株式会社,＜年間休日120日・定時退社可＞※不動産経験不問,他業種からでも年収1000万可能【不動産営業】◆30代～活躍中！,正社員,400万円～2000万円
229,株式会社ietty,【オンライン不動産サービス『ietty』を運営】★残業1日1h以下,AIで営業効率を最大化する【賃貸仲介営業】★完全週休2日,正社員,300万円～1500万円
230,生和コーポレーション株式会社,松岡修造さんのテレビCMでお馴染み！年間着工数13年連続全国1位,SEIWAグループの【提案営業】★2年目で年収1312万円の社員も！,正社員,350万円～1500万円
231,株式会社タウ,ダメージカーのリユース・リサイクルの総合商社・産育休実績有,【社内SE】完休2日(土日祝)*残業ほぼなし！*年間休125日*時短OK,正社員,520万円～650万円
232,有限会社アイユーホーム,設立以来決算賞与支給中！北九州からの転勤なし,完全反響型【カウンター営業】未経験OK、完全週休2日制・110日,正社員,
233,光和電設株式会社,100%直請け★アパホテルやドン・キホーテ、コメリなどの実績多数,"技術よりも""温かい心""を持った方を採用します！【電気工事士】",正社員,
234,株式会社SHOEI,★研修制度あり★残業月20h程度★年休120日以上★産育休実績あり,*+女性が活躍中+*【営業】★選べる働き方＝週2日休or週3日休,正社員,280万円～600万円
235,有限会社アサミ建設,育成枠⇒複数名の採用予定｜転勤なし｜未経験でも月給28万円以上,イチから手に職を！【施工スタッフ】残業少なめ／長期休暇も充実,正社員,350万円～600万円
236,株式会社ストライクシステム,毎年『1.5倍ペース』の増収/増員に成功する安定急成長グループ,売上還元率90％！報酬でぶっちぎる【SE・PG】◆前職給与保証,正社員,
237,ほけん選科株式会社,全国で来店型保険ショップを展開★月9～11日休み・年間休日123日,【ライフコンサルタント】年収1000万円以上稼ぎたい方歓迎,正社員,250万円～1000万円
238,株式会社LANDIC,デジタルとアナログを活用してお客様のライフスタイルをデザイン,未経験歓迎！不動産業界経験者優遇【反響型営業】完全週休2日制,正社員,400万円～500万円
239,株式会社大登,月給24万円~に歩合＆各種インセン賞与年2回◆やる気と実積を評価,続々OPEN【営業】★入社1年目で月収50万円以上可能★車通勤OK,正社員,300万円～700万円
240,東海住宅株式会社,設立50年・注文住宅からリフォームまで手掛ける総合不動産会社,【不動産営業】＊完全週休2日・年休120日・1年目で年収600万円可,正社員,350万円～600万円
241,四国化工建設株式会社,「ショーボンドホールディングス（東証一部上場）」グループ,☆未経験&経験者募集☆【土木建築施工管理】賞与６～10ヵ月実績,正社員,
242,株式会社浜寺ガスセンター,【大阪府緊急雇用対策に賛同】年収800万円も目指せる/既婚率70％,【総合職(営業/メンテナンス)】※残業少なく・賞与平均4ヶ月に,正社員,
243,株式会社Kraft,【大阪府緊急雇用対策に賛同】独立支援あり＆単身者用の寮も完備,未経験OK！高収入が叶う【通信工事スタッフ】★入社祝い金あり！,正社員,
244,株式会社ファースト,【不況知らずのカスタムカー専門店】＊平均年収600万円以上！,【カーコンシェルジュ】＊未経験大歓迎！残業ほぼなし・転勤なし,正社員,450万円～650万円
245,株式会社サンテック,自分の時間や収入が増加！営業活動”ゼロ”でしっかり稼げる,割り振られた案件をこなして月収50万円超【家電修理スタッフ】,業務委託,
246,株式会社サンドリア,【パナソニックLSスマートエナジー（株）一次販売代理店】,大手メーカー商品の【提案営業】★ほぼ残業なし★完全週休2日,正社員,350万円～500万円
247,株式会社エージェント,経験を活かして活躍の場を広げる！＜安定の上場企業＞週休2日制,プロモーション企画・販売・イベント運営（ＳＶ・ディレクター）,契約社員,420万円～480万円
248,株式会社花山工務店,<大阪ガスのパートナー企業>創業59年／大阪府緊急雇用対策に賛同,【技術スタッフ】◎土日休み◎資格取得支援◎年収1000万円も可能,正社員,
249,昭和ルーフリモ株式会社,【★リモートワーク推進★18～19時には退社★社用車通勤OK】,定着率の高さが自慢【やね工事のルート管理スタッフ】★未経験OK,正社員,350万円～700万円
